{"typedAnalyses":[{"selectedTypedAssessments":["assessment-a"],"selectedTypedValues":[],"typedAnalysisId":"analysis-a","typedAnalysisProposition":"prop-a","typedAnalysisRule":"rule-a","typedAnalysisScope":{"scopeActor":"orin","scopeContext":"archive-morning"}},{"selectedTypedAssessments":["assessment-b"],"selectedTypedValues":[],"typedAnalysisId":"analysis-b","typedAnalysisProposition":"prop-b","typedAnalysisRule":"rule-b","typedAnalysisScope":{"scopeActor":"vera","scopeContext":"archive-evening"}}],"typedAnnotations":[],"typedApplications":[{"applicationMeta":{"typedCitation":null,"typedId":"app-a","typedLabel":"app-a","typedSources":[]},"applicationTuple":{"tupleArguments":["orin","cabinet-red","read"],"tuplePredicate":"permission"}},{"applicationMeta":{"typedCitation":null,"typedId":"app-b","typedLabel":"app-b","typedSources":[]},"applicationTuple":{"tupleArguments":["vera","cabinet-blue","read"],"tuplePredicate":"permission"}}],"typedAssessments":[{"assessedApplication":"app-a","assessedTuple":{"tupleArguments":["orin","cabinet-red","read"],"tuplePredicate":"permission"},"typedAssertionRefs":["packet","packet"],"typedAssessmentMeta":{"typedCitation":null,"typedId":"assessment-a","typedLabel":"assessment-a","typedSources":[]},"typedAssessmentReason":"Synthetic technical input; no legal conclusion","typedAssessmentScope":{"scopeActor":"orin","scopeContext":"archive-morning"},"typedBasis":"assumption","typedClassification":{"tag":"TechnicalTrue"},"typedIssuer":"independent-review","typedOrigin":"synthetic_fixture"},{"assessedApplication":"app-b","assessedTuple":{"tupleArguments":["vera","cabinet-blue","read"],"tuplePredicate":"permission"},"typedAssertionRefs":[],"typedAssessmentMeta":{"typedCitation":null,"typedId":"assessment-b","typedLabel":"assessment-b","typedSources":[]},"typedAssessmentReason":"Synthetic technical input; no legal conclusion","typedAssessmentScope":{"scopeActor":"vera","scopeContext":"archive-evening"},"typedBasis":"assumption","typedClassification":{"contents":"not inspected","tag":"TechnicalUnresolved"},"typedIssuer":"independent-review","typedOrigin":"synthetic_fixture"}],"typedCaseAssertions":[{"assertionDescription":"Fictional repeated provenance","assertionId":"packet","assertionScope":{"scopeActor":"orin","scopeContext":"archive-morning"},"assertionSources":[{"referenceSource":"original","referenceSpan":{"end":5,"endColumn":6,"endLine":1,"start":2,"startColumn":3,"startLine":1}}]}],"typedDocumentFormat":"yuho.authoring/v0.3-experimental","typedDocumentId":"fictional-archive","typedEntities":[{"entityMeta":{"typedCitation":null,"typedId":"orin","typedLabel":"orin","typedSources":[]},"entityNominalType":"actor"},{"entityMeta":{"typedCitation":null,"typedId":"vera","typedLabel":"vera","typedSources":[]},"entityNominalType":"actor"},{"entityMeta":{"typedCitation":null,"typedId":"cabinet-red","typedLabel":"cabinet-red","typedSources":[]},"entityNominalType":"resource"},{"entityMeta":{"typedCitation":null,"typedId":"cabinet-blue","typedLabel":"cabinet-blue","typedSources":[]},"entityNominalType":"resource"},{"entityMeta":{"typedCitation":null,"typedId":"read","typedLabel":"read","typedSources":[]},"entityNominalType":"access-kind"}],"typedEntityTypes":[{"entityTypeMeta":{"typedCitation":null,"typedId":"actor","typedLabel":"actor","typedSources":[]}},{"entityTypeMeta":{"typedCitation":null,"typedId":"resource","typedLabel":"resource","typedSources":[]}},{"entityTypeMeta":{"typedCitation":null,"typedId":"access-kind","typedLabel":"access-kind","typedSources":[]}}],"typedExpressions":[{"expressionForm":{"contents":"app-a","tag":"GroundApplication"},"expressionMeta":{"typedCitation":null,"typedId":"expr-a","typedLabel":"expr-a","typedSources":[{"referenceSource":"original","referenceSpan":{"end":5,"endColumn":6,"endLine":1,"start":2,"startColumn":3,"startLine":1}}]}},{"expressionForm":{"contents":"app-b","tag":"GroundApplication"},"expressionMeta":{"typedCitation":null,"typedId":"expr-b","typedLabel":"expr-b","typedSources":[]}}],"typedLawId":"archive-protocol","typedLawRevision":"review-1","typedLimitations":["Fictional technical classification demonstration, not law."],"typedLinks":[{"typedLinkFrom":"rule-a","typedLinkId":"body-a","typedLinkKind":"typed_body","typedLinkTo":"expr-a"},{"typedLinkFrom":"rule-b","typedLinkId":"body-b","typedLinkKind":"typed_body","typedLinkTo":"expr-b"}],"typedOriginalSources":[{"sourceId":"original","sourceKind":"synthetic","sourceLocator":null,"sourceText":"é猫\nOrin and Vera inspect fictional archive cabinets."}],"typedPredicates":[{"predicateMeta":{"typedCitation":null,"typedId":"permission","typedLabel":"permission","typedSources":[]},"predicateRoles":[{"argumentRole":"recipient","argumentType":"actor"},{"argumentRole":"cabinet","argumentType":"resource"},{"argumentRole":"mode","argumentType":"access-kind"}]}],"typedPresentation":[],"typedPropositions":[{"propositionMeta":{"typedCitation":null,"typedId":"prop-a","typedLabel":"prop-a","typedSources":[]}},{"propositionMeta":{"typedCitation":null,"typedId":"prop-b","typedLabel":"prop-b","typedSources":[]}}],"typedRules":[{"typedRuleConclusion":"prop-a","typedRuleMeta":{"typedCitation":null,"typedId":"rule-a","typedLabel":"rule-a","typedSources":[]}},{"typedRuleConclusion":"prop-b","typedRuleMeta":{"typedCitation":null,"typedId":"rule-b","typedLabel":"rule-b","typedSources":[]}}],"typedScalars":[],"typedValues":[]}